{
  "$schema": "http://json-schema.org/draft-04/schema#",
  "title": "TY 2025-26",
  "description": "Create And Amend Other Income Request",
  "type": "object",
  "properties": {
    "postCessationReceipts": {"$ref": "../../other_definitions.json#/definitions/postCessationReceipts"},
    "allOtherIncomeReceivedWhilstAbroad": {"$ref": "../../other_definitions.json#/definitions/allOtherIncomeReceivedWhilstAbroad"},
    "overseasIncomeAndGains": {"$ref": "../../other_definitions.json#/definitions/overseasIncomeAndGains"},
    "chargeableForeignBenefitsAndGifts": {"$ref": "../../other_definitions.json#/definitions/chargeableForeignBenefitsAndGifts"},
    "omittedForeignIncome": {"$ref": "../../other_definitions.json#/definitions/omittedForeignIncome"},
    "benefitFromPreOwnedAssets": {"$ref": "../../other_definitions.json#/definitions/benefitFromPreOwnedAssets"},
    "additionalIncome": {"$ref": "../../other_definitions.json#/definitions/additionalIncome"}
  }
}

